iteration	param	old_val	new_val	old_score	new_score	kept	duration_ms	drift	strategy
2	2.1073	0.9792	0.037995	0.0	keep	min_relevance_threshold: None -> 0.1282
3	2.1073	0.9792	0.037995	0.0	keep	weight_semantic_sim: None -> 0.3348
4	2.1073	0.9792	0.037995	0.0	keep	weight_frequency: None -> 0.2983
5	2.1073	0.9792	0.037995	0.0	keep	weight_semantic_sim: None -> 0.4287
6	2.1073	0.9792	0.037995	0.0	keep	exploration_rate: None -> 0.1406
7	2.1073	0.9792	0.037995	0.0	keep	weight_semantic_sim: None -> 0.3438
8	2.1073	0.9792	0.037995	0.0	keep	min_relevance_threshold: None -> 0.1137
9	2.1073	0.9792	0.037995	0.0	keep	min_relevance_threshold: None -> 0.1186
10	2.1073	0.9792	0.037995	0.0	keep	weight_semantic_sim: None -> 0.3749
0	2.1073	0.9792	0.037995	0.0	keep	baseline
1	2.1073	0.9792	0.037995	0.0	keep	weight_semantic_sim: None -> 0.3505
2	2.1073	0.9792	0.037995	0.0	keep	decay_half_life_turns: None -> 28
3	2.1073	0.9792	0.037995	0.0	keep	weight_frequency: None -> 0.4027
4	2.1073	0.9792	0.037995	0.0	keep	decay_half_life_turns: None -> 27
5	2.1073	0.9792	0.037995	0.0	keep	weight_entropy: None -> 0.2446
6	2.1073	0.9792	0.037995	0.0	discard	exploration_rate: None -> 0.1901
7	2.1073	0.9792	0.037995	0.0	keep	exploration_rate: None -> 0.1072
8	2.1073	0.9792	0.037995	0.0	keep	decay_half_life_turns: None -> 24
9	2.1073	0.9792	0.037995	0.0	keep	weight_entropy: None -> 0.3325
10	2.1073	0.9792	0.037995	0.0	keep	decay_half_life_turns: None -> 30
0	2.1073	0.9792	0.037995	0.0	keep	baseline
1	2.1073	0.9792	0.037995	0.0	keep	weight_frequency: None -> 0.2634
